[
  {
    "id": "occ_wine_gadachrili_6000_5800_bce",
    "subjectRef": "wine",
    "placeRef": "gadachrili_gora",
    "period": {
      "start": -6000,
      "end": -5800,
      "precision": "range",
      "display": "ca. 6000–5800 a. C.",
      "note": "Rango publicado para la evidencia biomolecular y arqueobotánica del estudio."
    },
    "occurrenceType": "archaeological_presence",
    "evidenceType": "biomolecular",
    "certainty": "high",
    "summary": "Análisis químicos de compuestos absorbidos en cerámica, apoyados por datos arqueobotánicos, aportan evidencia temprana de vino de uva/vinicultura en el Cáucaso meridional.",
    "contextRefs": [
      "shulaveri_shomutepe"
    ],
    "developmentRefs": [],
    "sourceRefs": [
      "src_mcgovern_2017_neolithic_wine"
    ],
    "status": "reviewed"
  },
  {
    "id": "occ_maize_xihuatoxtla_early_holocene",
    "subjectRef": "maize",
    "placeRef": "xihuatoxtla_shelter",
    "period": {
      "start": -7040,
      "end": -6660,
      "precision": "range",
      "display": "8990–8610 cal BP (≈7040–6660 a. C.)",
      "note": "El rango histórico mostrado es una conversión aproximada de la datación calibrada BP publicada; se conserva el valor cal BP original."
    },
    "occurrenceType": "domestication_evidence",
    "evidenceType": "archaeobotanical",
    "certainty": "high",
    "summary": "Almidones y fitolitos de maíz asociados a herramientas y sedimentos aparecen en niveles contemporáneos o inferiores al horizonte radiocarbónico 8990–8610 cal BP de Xihuatoxtla.",
    "contextRefs": [],
    "developmentRefs": [],
    "sourceRefs": [
      "src_ranere_2009_balsas_context",
      "src_piperno_2009_balsas_maize",
      "src_maize_pnas_commentary_2009"
    ],
    "status": "verified",
    "verification": {
      "verifiedOn": "2026-08-11",
      "method": "independent_scholarly_review",
      "independentSourceRefs": [
        "src_maize_pnas_commentary_2009"
      ],
      "note": "La presencia temprana de maíz y su encaje en el proceso de domesticación del Balsas fueron revisados mediante comentario académico independiente."
    }
  },
  {
    "id": "occ_garum_pompeii_first_century",
    "subjectRef": "garum",
    "placeRef": "pompeii",
    "period": {
      "start": 1,
      "end": 79,
      "precision": "range",
      "display": "siglo I d. C.; contexto pompeyano anterior a 79 d. C.",
      "note": "La fecha final refleja el contexto arqueológico de Pompeya; no se interpreta como fecha de invención del garum."
    },
    "occurrenceType": "production",
    "evidenceType": "archaeological",
    "certainty": "high",
    "summary": "El Antiquarium de Pompeya conserva un fragmento de ánfora con escamas, espinas y residuo sólido de garum; el Parque Arqueológico señala que la salsa también se producía en Pompeya y era ampliamente utilizada en cocina romana.",
    "contextRefs": [
      "roman_empire_west_reference"
    ],
    "developmentRefs": [],
    "sourceRefs": [
      "src_pompeii_antiquarium_garum",
      "src_carannante_garum_2019",
      "src_garum_composition_2010"
    ],
    "status": "verified",
    "verification": {
      "verifiedOn": "2026-08-11",
      "method": "independent_archaeological_review",
      "independentSourceRefs": [
        "src_carannante_garum_2019",
        "src_garum_composition_2010"
      ],
      "note": "Restos materiales, arqueozoología y análisis de composición convergen en la identificación y producción de salsa de pescado en Pompeya."
    }
  },
  {
    "id": "occ_goat_ganj_dareh_8200_bce",
    "subjectRef": "goat",
    "placeRef": "ganj_dareh",
    "period": {
      "start": -8300,
      "end": -8100,
      "precision": "circa",
      "display": "ca. 8200 cal a. C.",
      "note": "La publicación sitúa el manejo de cabras genéticamente domésticas hacia 8200 cal a.C.; no implica un evento puntual de domesticación."
    },
    "occurrenceType": "domestication_evidence",
    "evidenceType": "genetic",
    "certainty": "high",
    "summary": "Arqueogenómica y perfiles arqueozoológicos indican manejo de rebaños de cabras genéticamente diferenciadas de poblaciones silvestres hacia 8200 cal a.C., antes de cambios morfológicos claros.",
    "contextRefs": [],
    "developmentRefs": [],
    "sourceRefs": [
      "src_goat_zagros_pnas_2021",
      "src_goat_domestication_mtdna_2008",
      "src_degroene_2023_goat_management"
    ],
    "status": "verified",
    "verification": {
      "verifiedOn": "2026-08-11",
      "method": "independent_isotopic_zooarchaeological_review",
      "independentSourceRefs": [
        "src_degroene_2023_goat_management"
      ],
      "note": "La inferencia de gestión caprina basada en genómica y perfiles arqueozoológicos se contrastó con un estudio independiente de isótopos estables y zooarqueología."
    }
  },
  {
    "id": "occ_bread_shubayqa_14400_bp",
    "subjectRef": "bread_like_flatbread",
    "placeRef": "shubayqa_1",
    "period": {
      "start": -12500,
      "end": -12300,
      "precision": "circa",
      "display": "ca. 14.400 cal BP (≈12.450 a. C.)",
      "note": "El estudio describe productos tipo pan de ca. 14.400 años; se conserva la naturaleza aproximada de la conversión."
    },
    "occurrenceType": "consumption",
    "evidenceType": "archaeobotanical",
    "certainty": "high",
    "summary": "Restos carbonizados muestran preparación de productos planos tipo pan con cereales silvestres y tubérculos por cazadores-recolectores natufienses, milenios antes de la agricultura consolidada.",
    "contextRefs": [
      "natufian"
    ],
    "developmentRefs": [],
    "sourceRefs": [
      "src_shubayqa_bread_pnas_2018",
      "src_shubayqa_dates_2017"
    ],
    "status": "reviewed"
  },
  {
    "id": "occ_cheese_kuyavia_sixth_millennium_bce",
    "subjectRef": "cheese",
    "placeRef": "kuyavia_poland",
    "period": {
      "start": -5500,
      "end": -5000,
      "precision": "millennium",
      "display": "VI milenio a. C.",
      "note": "El registro se expresa a escala de milenio; no se inventa un año concreto."
    },
    "occurrenceType": "production",
    "evidenceType": "biomolecular",
    "certainty": "high",
    "summary": "Residuos de grasa láctea en recipientes perforados proporcionan evidencia directa de separación de cuajada y suero, compatible con producción temprana de queso o productos lácteos reducidos en lactosa.",
    "contextRefs": [],
    "developmentRefs": [],
    "sourceRefs": [
      "src_cheese_nature_2013"
    ],
    "status": "reviewed"
  },
  {
    "id": "occ_forme_of_cury_1390",
    "subjectRef": "forme_of_cury",
    "placeRef": "england_richard_ii_reference",
    "period": {
      "start": 1385,
      "end": 1395,
      "precision": "circa",
      "display": "ca. 1390"
    },
    "occurrenceType": "textual_attestation",
    "evidenceType": "textual",
    "certainty": "high",
    "summary": "La British Library cataloga The Forme of Cury como tratado culinario compuesto hacia 1390 por los cocineros principales de la casa de Ricardo II.",
    "contextRefs": [
      "richard_ii_royal_household"
    ],
    "developmentRefs": [],
    "sourceRefs": [
      "src_forme_cury_bl",
      "src_forme_cury_loc",
      "src_forme_cury_harley_bl"
    ],
    "status": "verified",
    "verification": {
      "verifiedOn": "2026-08-11",
      "method": "independent_institutional_manuscript_review",
      "independentSourceRefs": [
        "src_forme_cury_loc"
      ],
      "note": "La datación aproximada y atribución cortesana se contrastaron entre catálogos institucionales independientes y copias manuscritas adicionales."
    }
  },
  {
    "id": "occ_wine_areni_4000_bce",
    "subjectRef": "wine",
    "placeRef": "areni_1_cave",
    "period": {
      "start": -4100,
      "end": -4000,
      "precision": "range",
      "display": "ca. 4100–4000 a. C.",
      "note": "El estudio sitúa la instalación y los residuos de producción en torno a 4000 cal a.C.; se conserva un intervalo prudente."
    },
    "occurrenceType": "production",
    "evidenceType": "biomolecular",
    "certainty": "high",
    "summary": "Instalaciones, restos botánicos y análisis químicos de cerámica de Areni-1 aportan evidencia de producción de vino en un contexto calcolítico.",
    "contextRefs": [],
    "developmentRefs": [],
    "sourceRefs": [
      "src_areni_wine_2011"
    ],
    "status": "reviewed"
  },
  {
    "id": "occ_wine_abydos_3150_bce",
    "subjectRef": "wine",
    "placeRef": "abydos_umm_el_qaab",
    "period": {
      "start": -3200,
      "end": -3100,
      "precision": "circa",
      "display": "ca. 3150 a. C.",
      "note": "La datación corresponde al contexto Naqada IIIa2 de la tumba U-j; no representa una fecha de introducción del vino en Egipto."
    },
    "occurrenceType": "archaeological_presence",
    "evidenceType": "biomolecular",
    "certainty": "high",
    "summary": "Residuos de recipientes de la tumba U-j de Abydos contienen biomarcadores compatibles con vino de uva y aditivos vegetales/resinosos.",
    "contextRefs": [
      "naqada_iiia2_dynasty_0"
    ],
    "developmentRefs": [],
    "sourceRefs": [
      "src_abydos_wine_2009"
    ],
    "status": "reviewed"
  },
  {
    "id": "occ_wine_tel_kabri_middle_bronze",
    "subjectRef": "wine",
    "placeRef": "tel_kabri",
    "period": {
      "start": -1900,
      "end": -1600,
      "precision": "range",
      "display": "Bronce Medio · ca. 1900–1600 a. C.",
      "note": "El intervalo corresponde al marco del palacio; no todas las vasijas se interpretan como depósitos independientes en todo el rango."
    },
    "occurrenceType": "storage",
    "evidenceType": "biomolecular",
    "certainty": "high",
    "summary": "Un complejo palacial con unas 40 grandes vasijas fue identificado como bodega de vino mediante análisis de residuos orgánicos, con indicios de vinos resinados y aditivos.",
    "contextRefs": [
      "tel_kabri_middle_bronze_palace"
    ],
    "developmentRefs": [],
    "sourceRefs": [